{
  "address": "0x2BB8731Eab4b67c47302510782280b7a07382885",
  "abi": [
    {
      "inputs": [
        {
          "internalType": "uint256",
          "name": "baseRatePerYear",
          "type": "uint256"
        },
        {
          "internalType": "uint256",
          "name": "multiplierPerYear",
          "type": "uint256"
        },
        {
          "internalType": "uint256",
          "name": "jumpMultiplierPerYear",
          "type": "uint256"
        },
        {
          "internalType": "uint256",
          "name": "kink_",
          "type": "uint256"
        },
        {
          "internalType": "address",
          "name": "owner_",
          "type": "address"
        }
      ],
      "stateMutability": "nonpayable",
      "type": "constructor"
    },
    {
      "anonymous": false,
      "inputs": [
        {
          "indexed": false,
          "internalType": "uint256",
          "name": "baseRatePerBlock",
          "type": "uint256"
        },
        {
          "indexed": false,
          "internalType": "uint256",
          "name": "multiplierPerBlock",
          "type": "uint256"
        },
        {
          "indexed": false,
          "internalType": "uint256",
          "name": "jumpMultiplierPerBlock",
          "type": "uint256"
        },
        {
          "indexed": false,
          "internalType": "uint256",
          "name": "kink",
          "type": "uint256"
        }
      ],
      "name": "NewInterestParams",
      "type": "event"
    },
    {
      "inputs": [],
      "name": "baseRatePerBlock",
      "outputs": [
        {
          "internalType": "uint256",
          "name": "",
          "type": "uint256"
        }
      ],
      "stateMutability": "view",
      "type": "function"
    },
    {
      "inputs": [],
      "name": "blocksPerYear",
      "outputs": [
        {
          "internalType": "uint256",
          "name": "",
          "type": "uint256"
        }
      ],
      "stateMutability": "view",
      "type": "function"
    },
    {
      "inputs": [
        {
          "internalType": "uint256",
          "name": "cash",
          "type": "uint256"
        },
        {
          "internalType": "uint256",
          "name": "borrows",
          "type": "uint256"
        },
        {
          "internalType": "uint256",
          "name": "reserves",
          "type": "uint256"
        }
      ],
      "name": "getBorrowRate",
      "outputs": [
        {
          "internalType": "uint256",
          "name": "",
          "type": "uint256"
        }
      ],
      "stateMutability": "view",
      "type": "function"
    },
    {
      "inputs": [
        {
          "internalType": "uint256",
          "name": "cash",
          "type": "uint256"
        },
        {
          "internalType": "uint256",
          "name": "borrows",
          "type": "uint256"
        },
        {
          "internalType": "uint256",
          "name": "reserves",
          "type": "uint256"
        },
        {
          "internalType": "uint256",
          "name": "reserveFactorMantissa",
          "type": "uint256"
        }
      ],
      "name": "getSupplyRate",
      "outputs": [
        {
          "internalType": "uint256",
          "name": "",
          "type": "uint256"
        }
      ],
      "stateMutability": "view",
      "type": "function"
    },
    {
      "inputs": [],
      "name": "isInterestRateModel",
      "outputs": [
        {
          "internalType": "bool",
          "name": "",
          "type": "bool"
        }
      ],
      "stateMutability": "view",
      "type": "function"
    },
    {
      "inputs": [],
      "name": "jumpMultiplierPerBlock",
      "outputs": [
        {
          "internalType": "uint256",
          "name": "",
          "type": "uint256"
        }
      ],
      "stateMutability": "view",
      "type": "function"
    },
    {
      "inputs": [],
      "name": "kink",
      "outputs": [
        {
          "internalType": "uint256",
          "name": "",
          "type": "uint256"
        }
      ],
      "stateMutability": "view",
      "type": "function"
    },
    {
      "inputs": [],
      "name": "multiplierPerBlock",
      "outputs": [
        {
          "internalType": "uint256",
          "name": "",
          "type": "uint256"
        }
      ],
      "stateMutability": "view",
      "type": "function"
    },
    {
      "inputs": [],
      "name": "owner",
      "outputs": [
        {
          "internalType": "address",
          "name": "",
          "type": "address"
        }
      ],
      "stateMutability": "view",
      "type": "function"
    },
    {
      "inputs": [
        {
          "internalType": "uint256",
          "name": "baseRatePerYear",
          "type": "uint256"
        },
        {
          "internalType": "uint256",
          "name": "multiplierPerYear",
          "type": "uint256"
        },
        {
          "internalType": "uint256",
          "name": "jumpMultiplierPerYear",
          "type": "uint256"
        },
        {
          "internalType": "uint256",
          "name": "kink_",
          "type": "uint256"
        }
      ],
      "name": "updateJumpRateModel",
      "outputs": [],
      "stateMutability": "nonpayable",
      "type": "function"
    },
    {
      "inputs": [
        {
          "internalType": "uint256",
          "name": "cash",
          "type": "uint256"
        },
        {
          "internalType": "uint256",
          "name": "borrows",
          "type": "uint256"
        },
        {
          "internalType": "uint256",
          "name": "reserves",
          "type": "uint256"
        }
      ],
      "name": "utilizationRate",
      "outputs": [
        {
          "internalType": "uint256",
          "name": "",
          "type": "uint256"
        }
      ],
      "stateMutability": "pure",
      "type": "function"
    }
  ],
  "transactionHash": "0xcab3af3a7655e13a297bd9a2e556f769846d1a93f744fa8b0eaddc03d22bf768",
  "receipt": {
    "to": null,
    "from": "0xc8693923643D93877A8E5609EE119C6De6cb4F8A",
    "contractAddress": "0x2BB8731Eab4b67c47302510782280b7a07382885",
    "transactionIndex": 71,
    "gasUsed": "431738",
    "logsBloom": "0x00000000000000000000000080000000000000000000000000000000000000000000000000000000000000000000000000000000000000000080000000000000000000000000000000000000000000000000000000000000000000000000000000000000000000000000000000000000000000000002000000000000000000000000000000000000000000000000000000000000000000000000000000000000000000000004000000000000000000000000080000000000000000000000000000000000000000000000000000000000040000000000000000000000000000000000000000000000000000000000000000000000000000000000000000000000",
    "blockHash": "0x77a68aee3efaad28013889604f400c85341e6782b158208256054b01087064a0",
    "transactionHash": "0xcab3af3a7655e13a297bd9a2e556f769846d1a93f744fa8b0eaddc03d22bf768",
    "logs": [
      {
        "transactionIndex": 71,
        "blockNumber": 7790736,
        "transactionHash": "0xcab3af3a7655e13a297bd9a2e556f769846d1a93f744fa8b0eaddc03d22bf768",
        "address": "0x2BB8731Eab4b67c47302510782280b7a07382885",
        "topics": [
          "0x6960ab234c7ef4b0c9197100f5393cfcde7c453ac910a27bd2000aa1dd4c068d"
        ],
        "data": "0x00000000000000000000000000000000000000000000000000000009160bcdd0000000000000000000000000000000000000000000000000000000000000000000000000000000000000000000000000000000000000000000000000000000000000000000000000000000000000000000000000000000000de0b6b3a7640000",
        "logIndex": 111,
        "blockHash": "0x77a68aee3efaad28013889604f400c85341e6782b158208256054b01087064a0"
      }
    ],
    "blockNumber": 7790736,
    "cumulativeGasUsed": "26428444",
    "status": 1,
    "byzantium": true
  },
  "args": [
    "102556590984000000",
    0,
    0,
    "1000000000000000000",
    "0xc8693923643D93877A8E5609EE119C6De6cb4F8A"
  ],
  "numDeployments": 1,
  "solcInputHash": "d2c97ef8b3090e9611f75a9397c9bfb7",
  "metadata": "{\"compiler\":{\"version\":\"0.8.13+commit.abaa5c0e\"},\"language\":\"Solidity\",\"output\":{\"abi\":[{\"inputs\":[{\"internalType\":\"uint256\",\"name\":\"baseRatePerYear\",\"type\":\"uint256\"},{\"internalType\":\"uint256\",\"name\":\"multiplierPerYear\",\"type\":\"uint256\"},{\"internalType\":\"uint256\",\"name\":\"jumpMultiplierPerYear\",\"type\":\"uint256\"},{\"internalType\":\"uint256\",\"name\":\"kink_\",\"type\":\"uint256\"},{\"internalType\":\"address\",\"name\":\"owner_\",\"type\":\"address\"}],\"stateMutability\":\"nonpayable\",\"type\":\"constructor\"},{\"anonymous\":false,\"inputs\":[{\"indexed\":false,\"internalType\":\"uint256\",\"name\":\"baseRatePerBlock\",\"type\":\"uint256\"},{\"indexed\":false,\"internalType\":\"uint256\",\"name\":\"multiplierPerBlock\",\"type\":\"uint256\"},{\"indexed\":false,\"internalType\":\"uint256\",\"name\":\"jumpMultiplierPerBlock\",\"type\":\"uint256\"},{\"indexed\":false,\"internalType\":\"uint256\",\"name\":\"kink\",\"type\":\"uint256\"}],\"name\":\"NewInterestParams\",\"type\":\"event\"},{\"inputs\":[],\"name\":\"baseRatePerBlock\",\"outputs\":[{\"internalType\":\"uint256\",\"name\":\"\",\"type\":\"uint256\"}],\"stateMutability\":\"view\",\"type\":\"function\"},{\"inputs\":[],\"name\":\"blocksPerYear\",\"outputs\":[{\"internalType\":\"uint256\",\"name\":\"\",\"type\":\"uint256\"}],\"stateMutability\":\"view\",\"type\":\"function\"},{\"inputs\":[{\"internalType\":\"uint256\",\"name\":\"cash\",\"type\":\"uint256\"},{\"internalType\":\"uint256\",\"name\":\"borrows\",\"type\":\"uint256\"},{\"internalType\":\"uint256\",\"name\":\"reserves\",\"type\":\"uint256\"}],\"name\":\"getBorrowRate\",\"outputs\":[{\"internalType\":\"uint256\",\"name\":\"\",\"type\":\"uint256\"}],\"stateMutability\":\"view\",\"type\":\"function\"},{\"inputs\":[{\"internalType\":\"uint256\",\"name\":\"cash\",\"type\":\"uint256\"},{\"internalType\":\"uint256\",\"name\":\"borrows\",\"type\":\"uint256\"},{\"internalType\":\"uint256\",\"name\":\"reserves\",\"type\":\"uint256\"},{\"internalType\":\"uint256\",\"name\":\"reserveFactorMantissa\",\"type\":\"uint256\"}],\"name\":\"getSupplyRate\",\"outputs\":[{\"internalType\":\"uint256\",\"name\":\"\",\"type\":\"uint256\"}],\"stateMutability\":\"view\",\"type\":\"function\"},{\"inputs\":[],\"name\":\"isInterestRateModel\",\"outputs\":[{\"internalType\":\"bool\",\"name\":\"\",\"type\":\"bool\"}],\"stateMutability\":\"view\",\"type\":\"function\"},{\"inputs\":[],\"name\":\"jumpMultiplierPerBlock\",\"outputs\":[{\"internalType\":\"uint256\",\"name\":\"\",\"type\":\"uint256\"}],\"stateMutability\":\"view\",\"type\":\"function\"},{\"inputs\":[],\"name\":\"kink\",\"outputs\":[{\"internalType\":\"uint256\",\"name\":\"\",\"type\":\"uint256\"}],\"stateMutability\":\"view\",\"type\":\"function\"},{\"inputs\":[],\"name\":\"multiplierPerBlock\",\"outputs\":[{\"internalType\":\"uint256\",\"name\":\"\",\"type\":\"uint256\"}],\"stateMutability\":\"view\",\"type\":\"function\"},{\"inputs\":[],\"name\":\"owner\",\"outputs\":[{\"internalType\":\"address\",\"name\":\"\",\"type\":\"address\"}],\"stateMutability\":\"view\",\"type\":\"function\"},{\"inputs\":[{\"internalType\":\"uint256\",\"name\":\"baseRatePerYear\",\"type\":\"uint256\"},{\"internalType\":\"uint256\",\"name\":\"multiplierPerYear\",\"type\":\"uint256\"},{\"internalType\":\"uint256\",\"name\":\"jumpMultiplierPerYear\",\"type\":\"uint256\"},{\"internalType\":\"uint256\",\"name\":\"kink_\",\"type\":\"uint256\"}],\"name\":\"updateJumpRateModel\",\"outputs\":[],\"stateMutability\":\"nonpayable\",\"type\":\"function\"},{\"inputs\":[{\"internalType\":\"uint256\",\"name\":\"cash\",\"type\":\"uint256\"},{\"internalType\":\"uint256\",\"name\":\"borrows\",\"type\":\"uint256\"},{\"internalType\":\"uint256\",\"name\":\"reserves\",\"type\":\"uint256\"}],\"name\":\"utilizationRate\",\"outputs\":[{\"internalType\":\"uint256\",\"name\":\"\",\"type\":\"uint256\"}],\"stateMutability\":\"pure\",\"type\":\"function\"}],\"devdoc\":{\"author\":\"Arr00\",\"kind\":\"dev\",\"methods\":{\"getBorrowRate(uint256,uint256,uint256)\":{\"params\":{\"borrows\":\"The amount of borrows in the market\",\"cash\":\"The amount of cash in the market\",\"reserves\":\"The amount of reserves in the market\"},\"returns\":{\"_0\":\"The borrow rate percentage per block as a mantissa (scaled by 1e18)\"}},\"getSupplyRate(uint256,uint256,uint256,uint256)\":{\"params\":{\"borrows\":\"The amount of borrows in the market\",\"cash\":\"The amount of cash in the market\",\"reserveFactorMantissa\":\"The current reserve factor for the market\",\"reserves\":\"The amount of reserves in the market\"},\"returns\":{\"_0\":\"The supply rate percentage per block as a mantissa (scaled by BASE)\"}},\"updateJumpRateModel(uint256,uint256,uint256,uint256)\":{\"params\":{\"baseRatePerYear\":\"The approximate target base APR, as a mantissa (scaled by BASE)\",\"jumpMultiplierPerYear\":\"The multiplierPerBlock after hitting a specified utilization point\",\"kink_\":\"The utilization point at which the jump multiplier is applied\",\"multiplierPerYear\":\"The rate of increase in interest rate wrt utilization (scaled by BASE)\"}},\"utilizationRate(uint256,uint256,uint256)\":{\"params\":{\"borrows\":\"The amount of borrows in the market\",\"cash\":\"The amount of cash in the market\",\"reserves\":\"The amount of reserves in the market (currently unused)\"},\"returns\":{\"_0\":\"The utilization rate as a mantissa between [0, BASE]\"}}},\"title\":\"Compound's JumpRateModel Contract V2 for V2 cTokens\",\"version\":1},\"userdoc\":{\"kind\":\"user\",\"methods\":{\"baseRatePerBlock()\":{\"notice\":\"The base interest rate which is the y-intercept when utilization rate is 0\"},\"blocksPerYear()\":{\"notice\":\"The approximate number of blocks per year that is assumed by the interest rate model\"},\"getBorrowRate(uint256,uint256,uint256)\":{\"notice\":\"Calculates the current borrow rate per block\"},\"getSupplyRate(uint256,uint256,uint256,uint256)\":{\"notice\":\"Calculates the current supply rate per block\"},\"isInterestRateModel()\":{\"notice\":\"Indicator that this is an InterestRateModel contract (for inspection)\"},\"jumpMultiplierPerBlock()\":{\"notice\":\"The multiplierPerBlock after hitting a specified utilization point\"},\"kink()\":{\"notice\":\"The utilization point at which the jump multiplier is applied\"},\"multiplierPerBlock()\":{\"notice\":\"The multiplier of utilization rate that gives the slope of the interest rate\"},\"owner()\":{\"notice\":\"The address of the owner, i.e. the Timelock contract, which can update parameters directly\"},\"updateJumpRateModel(uint256,uint256,uint256,uint256)\":{\"notice\":\"Update the parameters of the interest rate model (only callable by owner, i.e. Timelock)\"},\"utilizationRate(uint256,uint256,uint256)\":{\"notice\":\"Calculates the utilization rate of the market: `borrows / (cash + borrows - reserves)`\"}},\"notice\":\"Supports only for V2 cTokens\",\"version\":1}},\"settings\":{\"compilationTarget\":{\"contracts/JumpRateModelV2.sol\":\"JumpRateModelV2\"},\"evmVersion\":\"london\",\"libraries\":{\":__CACHE_BREAKER__\":\"0x00000000d41867734bbee4c6863d9255b2b06ac1\"},\"metadata\":{\"bytecodeHash\":\"ipfs\",\"useLiteralContent\":true},\"optimizer\":{\"enabled\":true,\"runs\":250},\"remappings\":[]},\"sources\":{\"contracts/BaseJumpRateModelV2.sol\":{\"content\":\"// SPDX-License-Identifier: BSD-3-Clause\\npragma solidity ^0.8.10;\\n\\nimport \\\"./InterestRateModel.sol\\\";\\n\\n/**\\n * @title Logic for Compound's JumpRateModel Contract V2.\\n * @author Compound (modified by Dharma Labs, refactored by Arr00)\\n * @notice Version 2 modifies Version 1 by enabling updateable parameters.\\n */\\nabstract contract BaseJumpRateModelV2 is InterestRateModel {\\n  event NewInterestParams(uint256 baseRatePerBlock, uint256 multiplierPerBlock, uint256 jumpMultiplierPerBlock, uint256 kink);\\n\\n  uint256 private constant BASE = 1e18;\\n\\n  /**\\n   * @notice The address of the owner, i.e. the Timelock contract, which can update parameters directly\\n   */\\n  address public owner;\\n\\n  /**\\n   * @notice The approximate number of blocks per year that is assumed by the interest rate model\\n   */\\n  uint256 public constant blocksPerYear = 2628000;\\n\\n  /**\\n   * @notice The multiplier of utilization rate that gives the slope of the interest rate\\n   */\\n  uint256 public multiplierPerBlock;\\n\\n  /**\\n   * @notice The base interest rate which is the y-intercept when utilization rate is 0\\n   */\\n  uint256 public baseRatePerBlock;\\n\\n  /**\\n   * @notice The multiplierPerBlock after hitting a specified utilization point\\n   */\\n  uint256 public jumpMultiplierPerBlock;\\n\\n  /**\\n   * @notice The utilization point at which the jump multiplier is applied\\n   */\\n  uint256 public kink;\\n\\n  /**\\n   * @notice Construct an interest rate model\\n   * @param baseRatePerYear The approximate target base APR, as a mantissa (scaled by BASE)\\n   * @param multiplierPerYear The rate of increase in interest rate wrt utilization (scaled by BASE)\\n   * @param jumpMultiplierPerYear The multiplierPerBlock after hitting a specified utilization point\\n   * @param kink_ The utilization point at which the jump multiplier is applied\\n   * @param owner_ The address of the owner, i.e. the Timelock contract (which has the ability to update parameters directly)\\n   */\\n  constructor(\\n    uint256 baseRatePerYear,\\n    uint256 multiplierPerYear,\\n    uint256 jumpMultiplierPerYear,\\n    uint256 kink_,\\n    address owner_\\n  ) internal {\\n    owner = owner_;\\n\\n    updateJumpRateModelInternal(baseRatePerYear, multiplierPerYear, jumpMultiplierPerYear, kink_);\\n  }\\n\\n  /**\\n   * @notice Update the parameters of the interest rate model (only callable by owner, i.e. Timelock)\\n   * @param baseRatePerYear The approximate target base APR, as a mantissa (scaled by BASE)\\n   * @param multiplierPerYear The rate of increase in interest rate wrt utilization (scaled by BASE)\\n   * @param jumpMultiplierPerYear The multiplierPerBlock after hitting a specified utilization point\\n   * @param kink_ The utilization point at which the jump multiplier is applied\\n   */\\n  function updateJumpRateModel(\\n    uint256 baseRatePerYear,\\n    uint256 multiplierPerYear,\\n    uint256 jumpMultiplierPerYear,\\n    uint256 kink_\\n  ) external virtual {\\n    require(msg.sender == owner, \\\"only the owner may call this function.\\\");\\n\\n    updateJumpRateModelInternal(baseRatePerYear, multiplierPerYear, jumpMultiplierPerYear, kink_);\\n  }\\n\\n  /**\\n   * @notice Calculates the utilization rate of the market: `borrows / (cash + borrows - reserves)`\\n   * @param cash The amount of cash in the market\\n   * @param borrows The amount of borrows in the market\\n   * @param reserves The amount of reserves in the market (currently unused)\\n   * @return The utilization rate as a mantissa between [0, BASE]\\n   */\\n  function utilizationRate(\\n    uint256 cash,\\n    uint256 borrows,\\n    uint256 reserves\\n  ) public pure returns (uint256) {\\n    // Utilization rate is 0 when there are no borrows\\n    if (borrows == 0) {\\n      return 0;\\n    }\\n\\n    return (borrows * BASE) / (cash + borrows - reserves);\\n  }\\n\\n  /**\\n   * @notice Calculates the current borrow rate per block, with the error code expected by the market\\n   * @param cash The amount of cash in the market\\n   * @param borrows The amount of borrows in the market\\n   * @param reserves The amount of reserves in the market\\n   * @return The borrow rate percentage per block as a mantissa (scaled by BASE)\\n   */\\n  function getBorrowRateInternal(\\n    uint256 cash,\\n    uint256 borrows,\\n    uint256 reserves\\n  ) internal view returns (uint256) {\\n    uint256 util = utilizationRate(cash, borrows, reserves);\\n\\n    if (util <= kink) {\\n      return ((util * multiplierPerBlock) / BASE) + baseRatePerBlock;\\n    } else {\\n      uint256 normalRate = ((kink * multiplierPerBlock) / BASE) + baseRatePerBlock;\\n      uint256 excessUtil = util - kink;\\n      return ((excessUtil * jumpMultiplierPerBlock) / BASE) + normalRate;\\n    }\\n  }\\n\\n  /**\\n   * @notice Calculates the current supply rate per block\\n   * @param cash The amount of cash in the market\\n   * @param borrows The amount of borrows in the market\\n   * @param reserves The amount of reserves in the market\\n   * @param reserveFactorMantissa The current reserve factor for the market\\n   * @return The supply rate percentage per block as a mantissa (scaled by BASE)\\n   */\\n  function getSupplyRate(\\n    uint256 cash,\\n    uint256 borrows,\\n    uint256 reserves,\\n    uint256 reserveFactorMantissa\\n  ) public view virtual override returns (uint256) {\\n    uint256 oneMinusReserveFactor = BASE - reserveFactorMantissa;\\n    uint256 borrowRate = getBorrowRateInternal(cash, borrows, reserves);\\n    uint256 rateToPool = (borrowRate * oneMinusReserveFactor) / BASE;\\n    return (utilizationRate(cash, borrows, reserves) * rateToPool) / BASE;\\n  }\\n\\n  /**\\n   * @notice Internal function to update the parameters of the interest rate model\\n   * @param baseRatePerYear The approximate target base APR, as a mantissa (scaled by BASE)\\n   * @param multiplierPerYear The rate of increase in interest rate wrt utilization (scaled by BASE)\\n   * @param jumpMultiplierPerYear The multiplierPerBlock after hitting a specified utilization point\\n   * @param kink_ The utilization point at which the jump multiplier is applied\\n   */\\n  function updateJumpRateModelInternal(\\n    uint256 baseRatePerYear,\\n    uint256 multiplierPerYear,\\n    uint256 jumpMultiplierPerYear,\\n    uint256 kink_\\n  ) internal {\\n    baseRatePerBlock = baseRatePerYear / blocksPerYear;\\n    multiplierPerBlock = (multiplierPerYear * BASE) / (blocksPerYear * kink_);\\n    jumpMultiplierPerBlock = jumpMultiplierPerYear / blocksPerYear;\\n    kink = kink_;\\n\\n    emit NewInterestParams(baseRatePerBlock, multiplierPerBlock, jumpMultiplierPerBlock, kink);\\n  }\\n}\\n\",\"keccak256\":\"0x8ec55784263def683e59208176f3e1bb26ebbcb1dc47bdc0559d55bc7f7b2dcf\",\"license\":\"BSD-3-Clause\"},\"contracts/InterestRateModel.sol\":{\"content\":\"// SPDX-License-Identifier: BSD-3-Clause\\npragma solidity ^0.8.10;\\n\\n/**\\n * @title Compound's InterestRateModel Interface\\n * @author Compound\\n */\\nabstract contract InterestRateModel {\\n  /// @notice Indicator that this is an InterestRateModel contract (for inspection)\\n  bool public constant isInterestRateModel = true;\\n\\n  /**\\n   * @notice Calculates the current borrow interest rate per block\\n   * @param cash The total amount of cash the market has\\n   * @param borrows The total amount of borrows the market has outstanding\\n   * @param reserves The total amount of reserves the market has\\n   * @return The borrow rate per block (as a percentage, and scaled by 1e18)\\n   */\\n  function getBorrowRate(\\n    uint256 cash,\\n    uint256 borrows,\\n    uint256 reserves\\n  ) external view virtual returns (uint256);\\n\\n  /**\\n   * @notice Calculates the current supply interest rate per block\\n   * @param cash The total amount of cash the market has\\n   * @param borrows The total amount of borrows the market has outstanding\\n   * @param reserves The total amount of reserves the market has\\n   * @param reserveFactorMantissa The current reserve factor the market has\\n   * @return The supply rate per block (as a percentage, and scaled by 1e18)\\n   */\\n  function getSupplyRate(\\n    uint256 cash,\\n    uint256 borrows,\\n    uint256 reserves,\\n    uint256 reserveFactorMantissa\\n  ) external view virtual returns (uint256);\\n}\\n\",\"keccak256\":\"0x43727226518030081cec4d53d9f3813bf0c74150d076beb45460de4544a66edb\",\"license\":\"BSD-3-Clause\"},\"contracts/JumpRateModelV2.sol\":{\"content\":\"// SPDX-License-Identifier: BSD-3-Clause\\npragma solidity ^0.8.10;\\n\\nimport \\\"./BaseJumpRateModelV2.sol\\\";\\nimport \\\"./InterestRateModel.sol\\\";\\n\\n/**\\n * @title Compound's JumpRateModel Contract V2 for V2 cTokens\\n * @author Arr00\\n * @notice Supports only for V2 cTokens\\n */\\ncontract JumpRateModelV2 is InterestRateModel, BaseJumpRateModelV2 {\\n  /**\\n   * @notice Calculates the current borrow rate per block\\n   * @param cash The amount of cash in the market\\n   * @param borrows The amount of borrows in the market\\n   * @param reserves The amount of reserves in the market\\n   * @return The borrow rate percentage per block as a mantissa (scaled by 1e18)\\n   */\\n  function getBorrowRate(\\n    uint256 cash,\\n    uint256 borrows,\\n    uint256 reserves\\n  ) external view override returns (uint256) {\\n    return getBorrowRateInternal(cash, borrows, reserves);\\n  }\\n\\n  constructor(\\n    uint256 baseRatePerYear,\\n    uint256 multiplierPerYear,\\n    uint256 jumpMultiplierPerYear,\\n    uint256 kink_,\\n    address owner_\\n  ) public BaseJumpRateModelV2(baseRatePerYear, multiplierPerYear, jumpMultiplierPerYear, kink_, owner_) {}\\n}\\n\",\"keccak256\":\"0xffbe77f6049c4e3250277e054f2dec76f3984ea2b23d985855033989314ac320\",\"license\":\"BSD-3-Clause\"}},\"version\":1}",
  "bytecode": "0x608060405234801561001057600080fd5b5060405161072d38038061072d83398101604081905261002f91610112565b600080546001600160a01b0319166001600160a01b038316179055848484848461005b8585858561006a565b505050505050505050506101bc565b610077622819a08561016d565b60025561008781622819a061018f565b610099670de0b6b3a76400008561018f565b6100a3919061016d565b6001556100b3622819a08361016d565b60038190556004829055600254600154604080519283526020830191909152810191909152606081018290527f6960ab234c7ef4b0c9197100f5393cfcde7c453ac910a27bd2000aa1dd4c068d9060800160405180910390a150505050565b600080600080600060a0868803121561012a57600080fd5b855160208701516040880151606089015160808a0151939850919650945092506001600160a01b038116811461015f57600080fd5b809150509295509295909350565b60008261018a57634e487b7160e01b600052601260045260246000fd5b500490565b60008160001904831182151516156101b757634e487b7160e01b600052601160045260246000fd5b500290565b610562806101cb6000396000f3fe608060405234801561001057600080fd5b50600436106100a95760003560e01c80638da5cb5b116100715780638da5cb5b1461011d578063a385fb9614610148578063b816881614610152578063b9f9850a14610165578063f14039de1461016e578063fd2da3391461017757600080fd5b806315f24053146100ae5780632037f3e7146100d45780632191f92a146100e95780636e71e2d8146101015780638726bb8914610114575b600080fd5b6100c16100bc366004610448565b610180565b6040519081526020015b60405180910390f35b6100e76100e2366004610474565b610197565b005b6100f1600181565b60405190151581526020016100cb565b6100c161010f366004610448565b610216565b6100c160015481565b600054610130906001600160a01b031681565b6040516001600160a01b0390911681526020016100cb565b6100c1622819a081565b6100c1610160366004610474565b610259565b6100c160035481565b6100c160025481565b6100c160045481565b600061018d8484846102d5565b90505b9392505050565b6000546001600160a01b031633146102045760405162461bcd60e51b815260206004820152602660248201527f6f6e6c7920746865206f776e6572206d61792063616c6c20746869732066756e60448201526531ba34b7b71760d11b606482015260840160405180910390fd5b610210848484846103a0565b50505050565b60008260000361022857506000610190565b8161023384866104bc565b61023d91906104d4565b61024f670de0b6b3a7640000856104eb565b61018d919061050a565b60008061026e83670de0b6b3a76400006104d4565b9050600061027d8787876102d5565b90506000670de0b6b3a764000061029484846104eb565b61029e919061050a565b9050670de0b6b3a7640000816102b58a8a8a610216565b6102bf91906104eb565b6102c9919061050a565b98975050505050505050565b6000806102e3858585610216565b9050600454811161032457600254670de0b6b3a76400006001548361030891906104eb565b610312919061050a565b61031c91906104bc565b915050610190565b6000600254670de0b6b3a764000060015460045461034291906104eb565b61034c919061050a565b61035691906104bc565b905060006004548361036891906104d4565b905081670de0b6b3a76400006003548361038291906104eb565b61038c919061050a565b61039691906104bc565b9350505050610190565b6103ad622819a08561050a565b6002556103bd81622819a06104eb565b6103cf670de0b6b3a7640000856104eb565b6103d9919061050a565b6001556103e9622819a08361050a565b60038190556004829055600254600154604080519283526020830191909152810191909152606081018290527f6960ab234c7ef4b0c9197100f5393cfcde7c453ac910a27bd2000aa1dd4c068d9060800160405180910390a150505050565b60008060006060848603121561045d57600080fd5b505081359360208301359350604090920135919050565b6000806000806080858703121561048a57600080fd5b5050823594602084013594506040840135936060013592509050565b634e487b7160e01b600052601160045260246000fd5b600082198211156104cf576104cf6104a6565b500190565b6000828210156104e6576104e66104a6565b500390565b6000816000190483118215151615610505576105056104a6565b500290565b60008261052757634e487b7160e01b600052601260045260246000fd5b50049056fea2646970667358221220a548432cb527959cd846b755df01799babace4d5548cc118065be8318b1864c764736f6c634300080d0033",
  "deployedBytecode": "0x608060405234801561001057600080fd5b50600436106100a95760003560e01c80638da5cb5b116100715780638da5cb5b1461011d578063a385fb9614610148578063b816881614610152578063b9f9850a14610165578063f14039de1461016e578063fd2da3391461017757600080fd5b806315f24053146100ae5780632037f3e7146100d45780632191f92a146100e95780636e71e2d8146101015780638726bb8914610114575b600080fd5b6100c16100bc366004610448565b610180565b6040519081526020015b60405180910390f35b6100e76100e2366004610474565b610197565b005b6100f1600181565b60405190151581526020016100cb565b6100c161010f366004610448565b610216565b6100c160015481565b600054610130906001600160a01b031681565b6040516001600160a01b0390911681526020016100cb565b6100c1622819a081565b6100c1610160366004610474565b610259565b6100c160035481565b6100c160025481565b6100c160045481565b600061018d8484846102d5565b90505b9392505050565b6000546001600160a01b031633146102045760405162461bcd60e51b815260206004820152602660248201527f6f6e6c7920746865206f776e6572206d61792063616c6c20746869732066756e60448201526531ba34b7b71760d11b606482015260840160405180910390fd5b610210848484846103a0565b50505050565b60008260000361022857506000610190565b8161023384866104bc565b61023d91906104d4565b61024f670de0b6b3a7640000856104eb565b61018d919061050a565b60008061026e83670de0b6b3a76400006104d4565b9050600061027d8787876102d5565b90506000670de0b6b3a764000061029484846104eb565b61029e919061050a565b9050670de0b6b3a7640000816102b58a8a8a610216565b6102bf91906104eb565b6102c9919061050a565b98975050505050505050565b6000806102e3858585610216565b9050600454811161032457600254670de0b6b3a76400006001548361030891906104eb565b610312919061050a565b61031c91906104bc565b915050610190565b6000600254670de0b6b3a764000060015460045461034291906104eb565b61034c919061050a565b61035691906104bc565b905060006004548361036891906104d4565b905081670de0b6b3a76400006003548361038291906104eb565b61038c919061050a565b61039691906104bc565b9350505050610190565b6103ad622819a08561050a565b6002556103bd81622819a06104eb565b6103cf670de0b6b3a7640000856104eb565b6103d9919061050a565b6001556103e9622819a08361050a565b60038190556004829055600254600154604080519283526020830191909152810191909152606081018290527f6960ab234c7ef4b0c9197100f5393cfcde7c453ac910a27bd2000aa1dd4c068d9060800160405180910390a150505050565b60008060006060848603121561045d57600080fd5b505081359360208301359350604090920135919050565b6000806000806080858703121561048a57600080fd5b5050823594602084013594506040840135936060013592509050565b634e487b7160e01b600052601160045260246000fd5b600082198211156104cf576104cf6104a6565b500190565b6000828210156104e6576104e66104a6565b500390565b6000816000190483118215151615610505576105056104a6565b500290565b60008261052757634e487b7160e01b600052601260045260246000fd5b50049056fea2646970667358221220a548432cb527959cd846b755df01799babace4d5548cc118065be8318b1864c764736f6c634300080d0033",
  "devdoc": {
    "author": "Arr00",
    "kind": "dev",
    "methods": {
      "getBorrowRate(uint256,uint256,uint256)": {
        "params": {
          "borrows": "The amount of borrows in the market",
          "cash": "The amount of cash in the market",
          "reserves": "The amount of reserves in the market"
        },
        "returns": {
          "_0": "The borrow rate percentage per block as a mantissa (scaled by 1e18)"
        }
      },
      "getSupplyRate(uint256,uint256,uint256,uint256)": {
        "params": {
          "borrows": "The amount of borrows in the market",
          "cash": "The amount of cash in the market",
          "reserveFactorMantissa": "The current reserve factor for the market",
          "reserves": "The amount of reserves in the market"
        },
        "returns": {
          "_0": "The supply rate percentage per block as a mantissa (scaled by BASE)"
        }
      },
      "updateJumpRateModel(uint256,uint256,uint256,uint256)": {
        "params": {
          "baseRatePerYear": "The approximate target base APR, as a mantissa (scaled by BASE)",
          "jumpMultiplierPerYear": "The multiplierPerBlock after hitting a specified utilization point",
          "kink_": "The utilization point at which the jump multiplier is applied",
          "multiplierPerYear": "The rate of increase in interest rate wrt utilization (scaled by BASE)"
        }
      },
      "utilizationRate(uint256,uint256,uint256)": {
        "params": {
          "borrows": "The amount of borrows in the market",
          "cash": "The amount of cash in the market",
          "reserves": "The amount of reserves in the market (currently unused)"
        },
        "returns": {
          "_0": "The utilization rate as a mantissa between [0, BASE]"
        }
      }
    },
    "title": "Compound's JumpRateModel Contract V2 for V2 cTokens",
    "version": 1
  },
  "userdoc": {
    "kind": "user",
    "methods": {
      "baseRatePerBlock()": {
        "notice": "The base interest rate which is the y-intercept when utilization rate is 0"
      },
      "blocksPerYear()": {
        "notice": "The approximate number of blocks per year that is assumed by the interest rate model"
      },
      "getBorrowRate(uint256,uint256,uint256)": {
        "notice": "Calculates the current borrow rate per block"
      },
      "getSupplyRate(uint256,uint256,uint256,uint256)": {
        "notice": "Calculates the current supply rate per block"
      },
      "isInterestRateModel()": {
        "notice": "Indicator that this is an InterestRateModel contract (for inspection)"
      },
      "jumpMultiplierPerBlock()": {
        "notice": "The multiplierPerBlock after hitting a specified utilization point"
      },
      "kink()": {
        "notice": "The utilization point at which the jump multiplier is applied"
      },
      "multiplierPerBlock()": {
        "notice": "The multiplier of utilization rate that gives the slope of the interest rate"
      },
      "owner()": {
        "notice": "The address of the owner, i.e. the Timelock contract, which can update parameters directly"
      },
      "updateJumpRateModel(uint256,uint256,uint256,uint256)": {
        "notice": "Update the parameters of the interest rate model (only callable by owner, i.e. Timelock)"
      },
      "utilizationRate(uint256,uint256,uint256)": {
        "notice": "Calculates the utilization rate of the market: `borrows / (cash + borrows - reserves)`"
      }
    },
    "notice": "Supports only for V2 cTokens",
    "version": 1
  },
  "storageLayout": {
    "storage": [
      {
        "astId": 67,
        "contract": "contracts/JumpRateModelV2.sol:JumpRateModelV2",
        "label": "owner",
        "offset": 0,
        "slot": "0",
        "type": "t_address"
      },
      {
        "astId": 74,
        "contract": "contracts/JumpRateModelV2.sol:JumpRateModelV2",
        "label": "multiplierPerBlock",
        "offset": 0,
        "slot": "1",
        "type": "t_uint256"
      },
      {
        "astId": 77,
        "contract": "contracts/JumpRateModelV2.sol:JumpRateModelV2",
        "label": "baseRatePerBlock",
        "offset": 0,
        "slot": "2",
        "type": "t_uint256"
      },
      {
        "astId": 80,
        "contract": "contracts/JumpRateModelV2.sol:JumpRateModelV2",
        "label": "jumpMultiplierPerBlock",
        "offset": 0,
        "slot": "3",
        "type": "t_uint256"
      },
      {
        "astId": 83,
        "contract": "contracts/JumpRateModelV2.sol:JumpRateModelV2",
        "label": "kink",
        "offset": 0,
        "slot": "4",
        "type": "t_uint256"
      }
    ],
    "types": {
      "t_address": {
        "encoding": "inplace",
        "label": "address",
        "numberOfBytes": "20"
      },
      "t_uint256": {
        "encoding": "inplace",
        "label": "uint256",
        "numberOfBytes": "32"
      }
    }
  }
}